{
  "schema_version": 1,
  "catalog_version": "HIMMA-CONTENT-1.0",
  "language": "ar",
  "direction": "rtl",
  "source": {
    "authority": "client_approved_docx",
    "original_path": "reference/original/01_المحتوى_والتخطيط_المعتمد_لمنصة_همة.docx",
    "original_sha256": "0689bccbac7803cdd5231eb46e519b7757f8432048fedaeda44df412740a7ad2",
    "derived_path": "reference/derived/01_المحتوى_والتخطيط_المعتمد_لمنصة_همة.md",
    "derived_sha256": "c8d26bc40a1eab27bc195813af30b32c99703aebb8c746dd2c15c4c2349da0cb"
  },
  "constraints": {
    "pretest_questions": 30,
    "posttest_questions": 30,
    "assessment_level_distribution": {
      "1": 10,
      "2": 12,
      "3": 8
    },
    "core_activities_per_level": 10,
    "reinforcement_activities_per_level": 5,
    "allowed_interactions": [
      "build_word",
      "choose_image",
      "choose_many",
      "choose_one",
      "listen_choose_image",
      "listen_choose_many",
      "listen_choose_one",
      "memory_sequence",
      "path_sequence",
      "read_aloud",
      "sequence",
      "timed_read_aloud"
    ],
    "one_skill_per_item": true,
    "one_interaction_per_item": true
  },
  "summary": {
    "item_count": 105,
    "skill_count": 44,
    "kind_counts": {
      "core_activity": 30,
      "posttest_question": 30,
      "pretest_question": 30,
      "reinforcement_activity": 15
    },
    "activity_counts_by_level": {
      "1": {
        "core": 10,
        "reinforcement": 5
      },
      "2": {
        "core": 10,
        "reinforcement": 5
      },
      "3": {
        "core": 10,
        "reinforcement": 5
      }
    },
    "declared_media_gap_count": 0
  },
  "levels": [
    {
      "level_id": 1,
      "name": "الاستعداد للقراءة",
      "core_activity_ids": [
        "L1-CORE-01",
        "L1-CORE-02",
        "L1-CORE-03",
        "L1-CORE-04",
        "L1-CORE-05",
        "L1-CORE-06",
        "L1-CORE-07",
        "L1-CORE-08",
        "L1-CORE-09",
        "L1-CORE-10"
      ],
      "reinforcement_activity_ids": [
        "L1-REIN-01",
        "L1-REIN-02",
        "L1-REIN-03",
        "L1-REIN-04",
        "L1-REIN-05"
      ]
    },
    {
      "level_id": 2,
      "name": "بناء الكلمة",
      "core_activity_ids": [
        "L2-CORE-01",
        "L2-CORE-02",
        "L2-CORE-03",
        "L2-CORE-04",
        "L2-CORE-05",
        "L2-CORE-06",
        "L2-CORE-07",
        "L2-CORE-08",
        "L2-CORE-09",
        "L2-CORE-10"
      ],
      "reinforcement_activity_ids": [
        "L2-REIN-01",
        "L2-REIN-02",
        "L2-REIN-03",
        "L2-REIN-04",
        "L2-REIN-05"
      ]
    },
    {
      "level_id": 3,
      "name": "الطلاقة والفهم",
      "core_activity_ids": [
        "L3-CORE-01",
        "L3-CORE-02",
        "L3-CORE-03",
        "L3-CORE-04",
        "L3-CORE-05",
        "L3-CORE-06",
        "L3-CORE-07",
        "L3-CORE-08",
        "L3-CORE-09",
        "L3-CORE-10"
      ],
      "reinforcement_activity_ids": [
        "L3-REIN-01",
        "L3-REIN-02",
        "L3-REIN-03",
        "L3-REIN-04",
        "L3-REIN-05"
      ]
    }
  ],
  "skills": [
    {
      "skill_id": "b683911d-679d-50b5-afe7-d3e2dcc7f8c9",
      "skill_code": "visual_motor_direction",
      "level_id": 1,
      "name": "التآزر البصري واتجاه القراءة"
    },
    {
      "skill_id": "c8bf1eaf-e9cd-55a0-bbe4-80608af3d69d",
      "skill_code": "logical_sequence",
      "level_id": 1,
      "name": "التسلسل المنطقي"
    },
    {
      "skill_id": "44f41319-60ef-5fdc-a597-63fc00343108",
      "skill_code": "letter_form_recognition",
      "level_id": 1,
      "name": "التعرف إلى أشكال الحرف"
    },
    {
      "skill_id": "403d8043-24e5-5900-83c9-a41c7d474d15",
      "skill_code": "visual_memory",
      "level_id": 1,
      "name": "الذاكرة البصرية"
    },
    {
      "skill_id": "c4633067-8b28-5a3f-beea-a52797b25160",
      "skill_code": "auditory_vocabulary",
      "level_id": 1,
      "name": "المفردات السمعية"
    },
    {
      "skill_id": "baef38df-1b80-59a8-9804-a34cb4193e35",
      "skill_code": "similar_letter_discrimination",
      "level_id": 1,
      "name": "تمييز الحروف المتشابهة"
    },
    {
      "skill_id": "da186f2e-f39e-5d25-a703-74d7f138107a",
      "skill_code": "visual_letter_discrimination",
      "level_id": 1,
      "name": "تمييز الحروف بصريًا"
    },
    {
      "skill_id": "31386543-f99c-50a7-b969-e0622aefe0ef",
      "skill_code": "sound_symbol_mapping",
      "level_id": 1,
      "name": "ربط الصوت بالحرف"
    },
    {
      "skill_id": "1276612f-127d-5585-b60d-9c51c3dff5d4",
      "skill_code": "final_sound_isolation",
      "level_id": 1,
      "name": "عزل الصوت الأخير"
    },
    {
      "skill_id": "2b6a09c0-072c-5860-b281-3b30ae345077",
      "skill_code": "initial_sound_isolation",
      "level_id": 1,
      "name": "عزل الصوت الأول"
    },
    {
      "skill_id": "bb5c2939-c62b-5a7c-abbb-4334c52c637e",
      "skill_code": "letter_reading",
      "level_id": 1,
      "name": "قراءة الحروف"
    },
    {
      "skill_id": "13b8fbee-ff74-5155-980b-5fc29bff59bc",
      "skill_code": "syllable_reading",
      "level_id": 1,
      "name": "قراءة المقاطع"
    },
    {
      "skill_id": "a1dec92c-8fa9-59c9-ac83-394f95d684d4",
      "skill_code": "print_concepts",
      "level_id": 1,
      "name": "مفاهيم المادة المطبوعة"
    },
    {
      "skill_id": "2fc43a84-5ac0-53fd-84b5-a8dbd354e803",
      "skill_code": "word_onset_comparison",
      "level_id": 1,
      "name": "مقارنة بدايات الكلمات"
    },
    {
      "skill_id": "97b26115-7de5-55ee-a9ad-b0e5238a924e",
      "skill_code": "word_completion",
      "level_id": 2,
      "name": "إكمال الكلمة"
    },
    {
      "skill_id": "c319c896-8cc1-5843-8708-89fee10fc411",
      "skill_code": "short_vowels",
      "level_id": 2,
      "name": "الحركات القصيرة"
    },
    {
      "skill_id": "5cd02c46-ee8e-5c86-867c-87ce8724dac4",
      "skill_code": "syllable_blending",
      "level_id": 2,
      "name": "الدمج المقطعي"
    },
    {
      "skill_id": "b9c29c26-06e8-5c4c-b06c-91fb3441207b",
      "skill_code": "long_vowels",
      "level_id": 2,
      "name": "المد"
    },
    {
      "skill_id": "5cc83642-30ed-5a77-a86f-dd6fccb55ff4",
      "skill_code": "sentence_building",
      "level_id": 2,
      "name": "بناء الجملة"
    },
    {
      "skill_id": "74105bf0-10ac-5f54-9d79-a4eae8199116",
      "skill_code": "word_building",
      "level_id": 2,
      "name": "بناء الكلمة"
    },
    {
      "skill_id": "95c68721-2776-5974-979e-5e741b45ddeb",
      "skill_code": "letter_order",
      "level_id": 2,
      "name": "ترتيب حروف الكلمة"
    },
    {
      "skill_id": "a6c4994b-d905-5857-b71d-b7b71ce0d73c",
      "skill_code": "tanween",
      "level_id": 2,
      "name": "تمييز التنوين"
    },
    {
      "skill_id": "ef732112-3ddc-563a-95c6-f2b4b5dd76e0",
      "skill_code": "auditory_word_discrimination",
      "level_id": 2,
      "name": "تمييز الكلمة سمعيًا"
    },
    {
      "skill_id": "6dec8f84-369b-531d-ae73-283816e0fd86",
      "skill_code": "sentence_reading",
      "level_id": 2,
      "name": "قراءة الجمل القصيرة"
    },
    {
      "skill_id": "60b02f6b-15d3-5337-b809-94cf52155916",
      "skill_code": "general_word_reading",
      "level_id": 2,
      "name": "قراءة الكلمات"
    },
    {
      "skill_id": "5b2d5404-09ec-550f-9cca-6c9429eb7a59",
      "skill_code": "syllable_reading",
      "level_id": 2,
      "name": "قراءة المقاطع"
    },
    {
      "skill_id": "f75344e9-f8a0-51ec-a43c-24041a3dfc9b",
      "skill_code": "short_vowel_word_reading",
      "level_id": 2,
      "name": "قراءة كلمات الحركات القصيرة"
    },
    {
      "skill_id": "61415afc-e00c-53ee-8d3c-7e9c16a7f348",
      "skill_code": "sukoon_word_reading",
      "level_id": 2,
      "name": "قراءة كلمات السكون"
    },
    {
      "skill_id": "11a1116e-4682-5a2e-905f-910b8a582399",
      "skill_code": "shadda_word_reading",
      "level_id": 2,
      "name": "قراءة كلمات الشدة"
    },
    {
      "skill_id": "ed89b33e-c53f-5068-94be-44f4774d420c",
      "skill_code": "madd_word_reading",
      "level_id": 2,
      "name": "قراءة كلمات المد"
    },
    {
      "skill_id": "728e51b2-494a-5fd3-b177-8fc61d21c663",
      "skill_code": "word_image_comprehension",
      "level_id": 2,
      "name": "مطابقة الكلمة بالصورة"
    },
    {
      "skill_id": "fd3b607b-0e75-5d65-b255-6e42548401d8",
      "skill_code": "text_evidence",
      "level_id": 3,
      "name": "الاستدلال من النص"
    },
    {
      "skill_id": "d83b3a7d-6c58-5805-9359-2072d6018463",
      "skill_code": "main_idea",
      "level_id": 3,
      "name": "الفكرة العامة"
    },
    {
      "skill_id": "a5df512a-9aea-531f-8fc1-d4de3ea97e98",
      "skill_code": "inferential_comprehension",
      "level_id": 3,
      "name": "الفهم الاستنتاجي"
    },
    {
      "skill_id": "e76fd684-39f7-5476-ad97-7c80c2229cf7",
      "skill_code": "literal_comprehension",
      "level_id": 3,
      "name": "الفهم المباشر"
    },
    {
      "skill_id": "b38896f0-cce9-543c-948c-52c5d2bffea1",
      "skill_code": "vocabulary",
      "level_id": 3,
      "name": "المفردات من السياق"
    },
    {
      "skill_id": "10b38a81-e1c0-5cbd-9ce6-efa1b020cc45",
      "skill_code": "sentence_building",
      "level_id": 3,
      "name": "بناء الجملة"
    },
    {
      "skill_id": "72ccaada-556f-5660-a49b-99d836571289",
      "skill_code": "event_sequence",
      "level_id": 3,
      "name": "تسلسل أحداث النص"
    },
    {
      "skill_id": "f092cdea-44e6-5ee2-beb4-77390ab6d4b3",
      "skill_code": "word_accuracy",
      "level_id": 3,
      "name": "دقة قراءة الكلمات"
    },
    {
      "skill_id": "bd43e35d-2fe7-5fd8-b110-47c5d11a273b",
      "skill_code": "passage_fluency",
      "level_id": 3,
      "name": "دقة وطلاقة قراءة النص"
    },
    {
      "skill_id": "8fde2bd8-ba7b-5b1f-94b8-320b0b1d9ff8",
      "skill_code": "timed_word_fluency",
      "level_id": 3,
      "name": "سرعة قراءة الكلمات مع الدقة"
    },
    {